{
  "$schema": "https://json-schema.org/draft/2020-12/schema",
  "$id": "https://academic-door.github.io/journals/schema/issue-v1.json",
  "title": "Academic Door Journal Issue",
  "type": "object",
  "required": [
    "schema_version",
    "issue_id",
    "journal_id",
    "journal_name",
    "volume",
    "issue",
    "source_url",
    "retrieved_at",
    "expected_article_count",
    "research_article_count",
    "status",
    "articles",
    "quality"
  ],
  "properties": {
    "schema_version": {
      "const": "1.0"
    },
    "issue_id": {
      "type": "string",
      "minLength": 3
    },
    "journal_id": {
      "type": "string",
      "minLength": 2
    },
    "journal_name": {
      "type": "string",
      "minLength": 3
    },
    "volume": {
      "type": "string"
    },
    "issue": {
      "type": "string"
    },
    "publication_date": {
      "type": "string"
    },
    "source_url": {
      "type": "string",
      "format": "uri"
    },
    "retrieved_at": {
      "type": "string",
      "format": "date-time"
    },
    "expected_article_count": {
      "type": "integer",
      "minimum": 0
    },
    "research_article_count": {
      "type": "integer",
      "minimum": 0
    },
    "status": {
      "enum": [
        "detected",
        "incomplete",
        "ready",
        "error"
      ]
    },
    "publication_state": {
      "enum": [
        "enriching",
        "ready",
        "source_pending",
        "translation_partial",
        "blocked"
      ]
    },
    "content_status": {
      "enum": [
        "complete",
        "metadata_complete",
        "translation_partial",
        "blocked"
      ]
    },
    "source_status": {
      "enum": [
        "official_verified",
        "publisher_verified",
        "source_pending"
      ]
    },
    "public_mode": {
      "enum": ["metadata_first_rights_qualified_v1"]
    },
    "public_content": {
      "type": "object",
      "required": ["mode", "metadata_articles", "abstracts_en_visible", "translations_cn_visible", "rights_withheld_articles"],
      "properties": {
        "mode": {"const": "metadata_first_rights_qualified_v1"},
        "metadata_articles": {"type": "integer", "minimum": 0},
        "abstracts_en_visible": {"type": "integer", "minimum": 0},
        "translations_cn_visible": {"type": "integer", "minimum": 0},
        "rights_withheld_articles": {"type": "integer", "minimum": 0}
      },
      "additionalProperties": false
    },
    "development_sample": {
      "type": "boolean"
    },
    "articles": {
      "type": "array",
      "items": {
        "$ref": "#/$defs/article"
      }
    },
    "quality": {
      "type": "object",
      "required": [
        "roster_match",
        "order_preserved",
        "doi_complete",
        "authors_complete",
        "abstract_en_complete",
        "translation_complete",
        "duplicate_count",
        "flags"
      ],
      "properties": {
        "roster_match": {
          "type": "boolean"
        },
        "order_preserved": {
          "type": "boolean"
        },
        "doi_complete": {
          "type": "integer",
          "minimum": 0
        },
        "authors_complete": {
          "type": "integer",
          "minimum": 0
        },
        "abstract_en_complete": {
          "type": "integer",
          "minimum": 0
        },
        "translation_complete": {
          "type": "integer",
          "minimum": 0
        },
        "duplicate_count": {
          "type": "integer",
          "minimum": 0
        },
        "flags": {
          "type": "array",
          "items": {
            "type": "string"
          }
        },
        "content_counts": {
          "$ref": "#/$defs/content_counts"
        },
        "official_item_count": {
          "type": "integer",
          "minimum": 0
        },
        "publishable_item_count": {
          "type": "integer",
          "minimum": 0
        },
        "excluded_item_count": {
          "type": "integer",
          "minimum": 0
        }
      },
      "additionalProperties": true
    },
    "content_counts": {
      "$ref": "#/$defs/content_counts"
    }
  },
  "$defs": {
    "article": {
      "type": "object",
      "required": [
        "paper_id",
        "sequence",
        "article_type",
        "title_en",
        "title_cn",
        "authors",
        "abstract_en",
        "abstract_cn",
        "doi",
        "source_url",
        "sources",
        "translation",
        "quality_flags"
      ],
      "properties": {
        "paper_id": {
          "type": "string",
          "minLength": 3
        },
        "sequence": {
          "type": "integer",
          "minimum": 1
        },
        "article_type": {
          "enum": [
            "research-article",
            "comment",
            "short-communication",
            "correction",
            "editorial",
            "front-matter",
            "other"
          ]
        },
        "title_en": {
          "type": "string",
          "minLength": 1
        },
        "title_cn": {
          "type": "string"
        },
        "authors": {
          "type": "array",
          "items": {
            "type": "string",
            "minLength": 1
          }
        },
        "abstract_en": {
          "type": "string"
        },
        "abstract_status": {
          "enum": [
            "official_not_provided"
          ]
        },
        "abstract_note": {
          "type": "string"
        },
        "abstract_cn": {
          "type": "string"
        },
        "abstract_snippet_en": {
          "type": "string"
        },
        "doi": {
          "type": "string"
        },
        "source_url": {
          "type": "string",
          "format": "uri"
        },
        "publication_date": {
          "type": "string"
        },
        "sources": {
          "type": "object"
        },
        "translation": {
          "type": "object"
        },
        "quality_flags": {
          "type": "array",
          "items": {
            "type": "string"
          }
        },
        "public_rights": {
          "type": "object",
          "required": ["status"],
          "properties": {
            "status": {"enum": ["withheld", "verified_cc_by_4_0"]},
            "reason": {"type": "string"},
            "license_url": {"type": "string", "format": "uri"},
            "evidence_url": {"type": "string", "format": "uri"},
            "reviewed_by": {"type": "string"},
            "attribution": {"type": "string"},
            "adaptation_notice": {"type": "string"}
          },
          "additionalProperties": false
        },
        "china_relevance": {
          "type": "object",
          "properties": {
            "status": {
              "enum": [
                "yes",
                "no",
                "uncertain"
              ]
            },
            "evidence": {
              "type": "string"
            },
            "matched_terms": {
              "type": "array",
              "items": {
                "type": "string"
              }
            },
            "source": {
              "type": "string"
            }
          },
          "additionalProperties": false
        }
      }
    },
    "content_counts": {
      "type": "object",
      "required": [
        "official_items",
        "observed_items",
        "publishable_items",
        "research_articles",
        "comments",
        "short_communications",
        "corrections",
        "editorial_material",
        "front_matter",
        "other_excluded",
        "catalog_content_items"
      ],
      "properties": {
        "official_items": {
          "type": "integer",
          "minimum": 0
        },
        "observed_items": {
          "type": "integer",
          "minimum": 0
        },
        "publishable_items": {
          "type": "integer",
          "minimum": 0
        },
        "research_articles": {
          "type": "integer",
          "minimum": 0
        },
        "comments": {
          "type": "integer",
          "minimum": 0
        },
        "short_communications": {
          "type": "integer",
          "minimum": 0
        },
        "corrections": {
          "type": "integer",
          "minimum": 0
        },
        "editorial_material": {
          "type": "integer",
          "minimum": 0
        },
        "front_matter": {
          "type": "integer",
          "minimum": 0
        },
        "other_excluded": {
          "type": "integer",
          "minimum": 0
        },
        "catalog_content_items": {
          "type": "integer",
          "minimum": 0
        }
      },
      "additionalProperties": false
    }
  }
}
