{
  "schema_version": "1.0",
  "issue_id": "ecta-93-3",
  "journal_id": "ecta",
  "journal_name": "Econometrica",
  "volume": "93",
  "issue": "3",
  "publication_date": "May 2025",
  "source_url": "https://ideas.repec.org/s/wly/emetrp.html",
  "retrieved_at": "2026-07-29T05:14:54+00:00",
  "expected_article_count": 10,
  "research_article_count": 10,
  "status": "incomplete",
  "development_sample": false,
  "articles": [
    {
      "paper_id": "ecta:Making Subsidies Work: Rules versus Discretion",
      "sequence": 1,
      "source_sequence": 1,
      "article_type": "research-article",
      "title_en": "Making Subsidies Work: Rules versus Discretion",
      "title_cn": "",
      "authors": [],
      "abstract_en": "",
      "abstract_cn": "",
      "doi": "",
      "source_url": "https://ideas.repec.org/a/wly/emetrp/v93y2025i3p747-778.html",
      "publication_date": "2025",
      "sources": {
        "issue": "https://ideas.repec.org/s/wly/emetrp.html",
        "roster": "repec-serial-page",
        "metadata": "crossref",
        "abstract_en": "",
        "repec": "https://ideas.repec.org/a/wly/emetrp/v93y2025i3p747-778.html"
      },
      "translation": {
        "status": "blocked",
        "provider": "",
        "prompt_version": "",
        "glossary_version": "1"
      },
      "quality_flags": [
        "title_cn_missing",
        "abstract_cn_missing",
        "doi_missing",
        "authors_missing",
        "abstract_en_missing"
      ],
      "china_relevance": {
        "status": "no",
        "evidence": "no substantive China signal",
        "matched_terms": [],
        "source": "academic-door-rules-v1"
      }
    },
    {
      "paper_id": "ecta:The Cost of Consumer Collateral: Evidence From Bunching",
      "sequence": 2,
      "source_sequence": 2,
      "article_type": "research-article",
      "title_en": "The Cost of Consumer Collateral: Evidence From Bunching",
      "title_cn": "",
      "authors": [],
      "abstract_en": "",
      "abstract_cn": "",
      "doi": "",
      "source_url": "https://ideas.repec.org/a/wly/emetrp/v93y2025i3p779-819.html",
      "publication_date": "2025",
      "sources": {
        "issue": "https://ideas.repec.org/s/wly/emetrp.html",
        "roster": "repec-serial-page",
        "metadata": "crossref",
        "abstract_en": "",
        "repec": "https://ideas.repec.org/a/wly/emetrp/v93y2025i3p779-819.html"
      },
      "translation": {
        "status": "blocked",
        "provider": "",
        "prompt_version": "",
        "glossary_version": "1"
      },
      "quality_flags": [
        "title_cn_missing",
        "abstract_cn_missing",
        "doi_missing",
        "authors_missing",
        "abstract_en_missing"
      ],
      "china_relevance": {
        "status": "no",
        "evidence": "no substantive China signal",
        "matched_terms": [],
        "source": "academic-door-rules-v1"
      }
    },
    {
      "paper_id": "ecta:Insurance and Inequality With Persistent Private Information",
      "sequence": 3,
      "source_sequence": 3,
      "article_type": "research-article",
      "title_en": "Insurance and Inequality With Persistent Private Information",
      "title_cn": "",
      "authors": [],
      "abstract_en": "",
      "abstract_cn": "",
      "doi": "",
      "source_url": "https://ideas.repec.org/a/wly/emetrp/v93y2025i3p821-857.html",
      "publication_date": "2025",
      "sources": {
        "issue": "https://ideas.repec.org/s/wly/emetrp.html",
        "roster": "repec-serial-page",
        "metadata": "crossref",
        "abstract_en": "",
        "repec": "https://ideas.repec.org/a/wly/emetrp/v93y2025i3p821-857.html"
      },
      "translation": {
        "status": "blocked",
        "provider": "",
        "prompt_version": "",
        "glossary_version": "1"
      },
      "quality_flags": [
        "title_cn_missing",
        "abstract_cn_missing",
        "doi_missing",
        "authors_missing",
        "abstract_en_missing"
      ],
      "china_relevance": {
        "status": "no",
        "evidence": "no substantive China signal",
        "matched_terms": [],
        "source": "academic-door-rules-v1"
      }
    },
    {
      "paper_id": "ecta:Auctioning Control and Cash‐Flow Rights Separately",
      "sequence": 4,
      "source_sequence": 4,
      "article_type": "research-article",
      "title_en": "Auctioning Control and Cash‐Flow Rights Separately",
      "title_cn": "",
      "authors": [],
      "abstract_en": "",
      "abstract_cn": "",
      "doi": "",
      "source_url": "https://ideas.repec.org/a/wly/emetrp/v93y2025i3p859-889.html",
      "publication_date": "2025",
      "sources": {
        "issue": "https://ideas.repec.org/s/wly/emetrp.html",
        "roster": "repec-serial-page",
        "metadata": "crossref",
        "abstract_en": "",
        "repec": "https://ideas.repec.org/a/wly/emetrp/v93y2025i3p859-889.html"
      },
      "translation": {
        "status": "blocked",
        "provider": "",
        "prompt_version": "",
        "glossary_version": "1"
      },
      "quality_flags": [
        "title_cn_missing",
        "abstract_cn_missing",
        "doi_missing",
        "authors_missing",
        "abstract_en_missing"
      ],
      "china_relevance": {
        "status": "no",
        "evidence": "no substantive China signal",
        "matched_terms": [],
        "source": "academic-door-rules-v1"
      }
    },
    {
      "paper_id": "ecta:Soaking up the Sun: Battery Investment, Renewable Energy, and Market Equilibrium",
      "sequence": 5,
      "source_sequence": 5,
      "article_type": "research-article",
      "title_en": "Soaking up the Sun: Battery Investment, Renewable Energy, and Market Equilibrium",
      "title_cn": "",
      "authors": [],
      "abstract_en": "",
      "abstract_cn": "",
      "doi": "",
      "source_url": "https://ideas.repec.org/a/wly/emetrp/v93y2025i3p891-927.html",
      "publication_date": "2025",
      "sources": {
        "issue": "https://ideas.repec.org/s/wly/emetrp.html",
        "roster": "repec-serial-page",
        "metadata": "crossref",
        "abstract_en": "",
        "repec": "https://ideas.repec.org/a/wly/emetrp/v93y2025i3p891-927.html"
      },
      "translation": {
        "status": "blocked",
        "provider": "",
        "prompt_version": "",
        "glossary_version": "1"
      },
      "quality_flags": [
        "title_cn_missing",
        "abstract_cn_missing",
        "doi_missing",
        "authors_missing",
        "abstract_en_missing"
      ],
      "china_relevance": {
        "status": "no",
        "evidence": "no substantive China signal",
        "matched_terms": [],
        "source": "academic-door-rules-v1"
      }
    },
    {
      "paper_id": "ecta:Personalized Pricing and the Value of Time: Evidence From Auctioned Cab Rides",
      "sequence": 6,
      "source_sequence": 6,
      "article_type": "research-article",
      "title_en": "Personalized Pricing and the Value of Time: Evidence From Auctioned Cab Rides",
      "title_cn": "",
      "authors": [],
      "abstract_en": "",
      "abstract_cn": "",
      "doi": "",
      "source_url": "https://ideas.repec.org/a/wly/emetrp/v93y2025i3p929-958.html",
      "publication_date": "2025",
      "sources": {
        "issue": "https://ideas.repec.org/s/wly/emetrp.html",
        "roster": "repec-serial-page",
        "metadata": "crossref",
        "abstract_en": "",
        "repec": "https://ideas.repec.org/a/wly/emetrp/v93y2025i3p929-958.html"
      },
      "translation": {
        "status": "blocked",
        "provider": "",
        "prompt_version": "",
        "glossary_version": "1"
      },
      "quality_flags": [
        "title_cn_missing",
        "abstract_cn_missing",
        "doi_missing",
        "authors_missing",
        "abstract_en_missing"
      ],
      "china_relevance": {
        "status": "no",
        "evidence": "no substantive China signal",
        "matched_terms": [],
        "source": "academic-door-rules-v1"
      }
    },
    {
      "paper_id": "ecta:Quality Disclosure and Regulation: Scoring Design in Medicare Advantage",
      "sequence": 7,
      "source_sequence": 7,
      "article_type": "research-article",
      "title_en": "Quality Disclosure and Regulation: Scoring Design in Medicare Advantage",
      "title_cn": "",
      "authors": [],
      "abstract_en": "",
      "abstract_cn": "",
      "doi": "",
      "source_url": "https://ideas.repec.org/a/wly/emetrp/v93y2025i3p959-1001.html",
      "publication_date": "2025",
      "sources": {
        "issue": "https://ideas.repec.org/s/wly/emetrp.html",
        "roster": "repec-serial-page",
        "metadata": "crossref",
        "abstract_en": "",
        "repec": "https://ideas.repec.org/a/wly/emetrp/v93y2025i3p959-1001.html"
      },
      "translation": {
        "status": "blocked",
        "provider": "",
        "prompt_version": "",
        "glossary_version": "1"
      },
      "quality_flags": [
        "title_cn_missing",
        "abstract_cn_missing",
        "doi_missing",
        "authors_missing",
        "abstract_en_missing"
      ],
      "china_relevance": {
        "status": "no",
        "evidence": "no substantive China signal",
        "matched_terms": [],
        "source": "academic-door-rules-v1"
      }
    },
    {
      "paper_id": "ecta:Risk and Optimal Policies in Bandit Experiments",
      "sequence": 8,
      "source_sequence": 8,
      "article_type": "research-article",
      "title_en": "Risk and Optimal Policies in Bandit Experiments",
      "title_cn": "",
      "authors": [],
      "abstract_en": "",
      "abstract_cn": "",
      "doi": "",
      "source_url": "https://ideas.repec.org/a/wly/emetrp/v93y2025i3p1003-1029.html",
      "publication_date": "2025",
      "sources": {
        "issue": "https://ideas.repec.org/s/wly/emetrp.html",
        "roster": "repec-serial-page",
        "metadata": "crossref",